{
  "schema_version": 2,
  "device": "NVIDIA GeForce RTX 5090",
  "scope": "dense documented PTX only",
  "sass_audit_enabled": true,
  "sass_gates_peak_selection": false,
  "headline": [
    {"mode": "without_mx", "pair": "fp8", "available": true, "peak_tflops": 1010.43508806, "format_a": "e5m2", "format_b": "e4m3", "direction": "fp8xfp8", "accumulator": "f16", "case": "dense/f8f6f4/e5m2xe4m3/acc-f16", "ptx": "mma.sync.aligned.kind::f8f6f4.m16n8k32.row.col.f16.e5m2.e4m3.f16", "sass_status": "SASS_OK", "sass_matches_expected": true, "sass_family": "QMMA"},
    {"mode": "without_mx", "pair": "fp6", "available": true, "peak_tflops": 510.665234999, "format_a": "e3m2", "format_b": "e2m3", "direction": "fp6xfp6", "accumulator": "f16", "case": "dense/f8f6f4/e3m2xe2m3/acc-f16", "ptx": "mma.sync.aligned.kind::f8f6f4.m16n8k32.row.col.f16.e3m2.e2m3.f16", "sass_status": "SASS_OK", "sass_matches_expected": true, "sass_family": "QMMA"},
    {"mode": "without_mx", "pair": "fp4", "available": true, "peak_tflops": 510.475128128, "format_a": "e2m1", "format_b": "e2m1", "direction": "fp4xfp4", "accumulator": "f16", "case": "dense/f8f6f4/e2m1xe2m1/acc-f16", "ptx": "mma.sync.aligned.kind::f8f6f4.m16n8k32.row.col.f16.e2m1.e2m1.f16", "sass_status": "SASS_OK", "sass_matches_expected": true, "sass_family": "QMMA"},
    {"mode": "without_mx", "pair": "fp8xfp6", "available": true, "peak_tflops": 1010.80178633, "format_a": "e5m2", "format_b": "e2m3", "direction": "fp8xfp6", "accumulator": "f16", "case": "dense/f8f6f4/e5m2xe2m3/acc-f16", "ptx": "mma.sync.aligned.kind::f8f6f4.m16n8k32.row.col.f16.e5m2.e2m3.f16", "sass_status": "SASS_OK", "sass_matches_expected": true, "sass_family": "QMMA"},
    {"mode": "without_mx", "pair": "fp8xfp4", "available": true, "peak_tflops": 1010.60692073, "format_a": "e5m2", "format_b": "e2m1", "direction": "fp8xfp4", "accumulator": "f16", "case": "dense/f8f6f4/e5m2xe2m1/acc-f16", "ptx": "mma.sync.aligned.kind::f8f6f4.m16n8k32.row.col.f16.e5m2.e2m1.f16", "sass_status": "SASS_OK", "sass_matches_expected": true, "sass_family": "QMMA"},
    {"mode": "without_mx", "pair": "fp6xfp4", "available": true, "peak_tflops": 510.754497204, "format_a": "e2m3", "format_b": "e2m1", "direction": "fp6xfp4", "accumulator": "f16", "case": "dense/f8f6f4/e2m3xe2m1/acc-f16", "ptx": "mma.sync.aligned.kind::f8f6f4.m16n8k32.row.col.f16.e2m3.e2m1.f16", "sass_status": "SASS_OK", "sass_matches_expected": true, "sass_family": "QMMA"},
    {"mode": "with_mx", "pair": "fp8", "available": true, "peak_tflops": 1006.06670929, "format_a": "e4m3", "format_b": "e4m3", "direction": "fp8xfp8", "accumulator": "f32", "case": "dense/mxf8f6f4/e4m3xe4m3/ue8m0-1X", "ptx": "mma.sync.aligned.kind::mxf8f6f4.block_scale.scale_vec::1X.m16n8k32.row.col.f32.e4m3.e4m3.f32.ue8m0", "sass_status": "SASS_OK", "sass_matches_expected": true, "sass_family": "QMMA.SF"},
    {"mode": "with_mx", "pair": "fp6", "available": true, "peak_tflops": 507.614351592, "format_a": "e2m3", "format_b": "e2m3", "direction": "fp6xfp6", "accumulator": "f32", "case": "dense/mxf8f6f4/e2m3xe2m3/ue8m0-default-1X", "ptx": "mma.sync.aligned.kind::mxf8f6f4.block_scale.m16n8k32.row.col.f32.e2m3.e2m3.f32.ue8m0", "sass_status": "SASS_OK", "sass_matches_expected": true, "sass_family": "QMMA.SF"},
    {"mode": "with_mx", "pair": "fp4", "available": true, "peak_tflops": 2003.39319865, "format_a": "e2m1", "format_b": "e2m1", "direction": "fp4xfp4", "accumulator": "f32", "case": "dense/mxf4/e2m1xe2m1/ue8m0-default-2X", "ptx": "mma.sync.aligned.kind::mxf4.block_scale.m16n8k64.row.col.f32.e2m1.e2m1.f32.ue8m0", "sass_status": "SASS_OK", "sass_matches_expected": true, "sass_family": "OMMA.SF"},
    {"mode": "with_mx", "pair": "fp8xfp6", "available": true, "peak_tflops": 1002.07385303, "format_a": "e5m2", "format_b": "e3m2", "direction": "fp8xfp6", "accumulator": "f32", "case": "dense/mxf8f6f4/e5m2xe3m2/ue8m0-1X", "ptx": "mma.sync.aligned.kind::mxf8f6f4.block_scale.scale_vec::1X.m16n8k32.row.col.f32.e5m2.e3m2.f32.ue8m0", "sass_status": "SASS_OK", "sass_matches_expected": true, "sass_family": "QMMA.SF"},
    {"mode": "with_mx", "pair": "fp8xfp4", "available": true, "peak_tflops": 1001.91615395, "format_a": "e5m2", "format_b": "e2m1", "direction": "fp8xfp4", "accumulator": "f32", "case": "dense/mxf8f6f4/e5m2xe2m1/ue8m0-1X", "ptx": "mma.sync.aligned.kind::mxf8f6f4.block_scale.scale_vec::1X.m16n8k32.row.col.f32.e5m2.e2m1.f32.ue8m0", "sass_status": "SASS_OK", "sass_matches_expected": true, "sass_family": "QMMA.SF"},
    {"mode": "with_mx", "pair": "fp6xfp4", "available": true, "peak_tflops": 507.614351592, "format_a": "e2m3", "format_b": "e2m1", "direction": "fp6xfp4", "accumulator": "f32", "case": "dense/mxf8f6f4/e2m3xe2m1/ue8m0-1X", "ptx": "mma.sync.aligned.kind::mxf8f6f4.block_scale.scale_vec::1X.m16n8k32.row.col.f32.e2m3.e2m1.f32.ue8m0", "sass_status": "SASS_OK", "sass_matches_expected": true, "sass_family": "QMMA.SF"}
  ],
  "nvfp4_reference": {"available": true, "peak_tflops": 2004.11396261, "format_a": "e2m1", "format_b": "e2m1", "case": "dense/mxf4nvf4/e2m1xe2m1/ue4m3-4X", "ptx": "mma.sync.aligned.kind::mxf4nvf4.block_scale.scale_vec::4X.m16n8k64.row.col.f32.e2m1.e2m1.f32.ue4m3", "sass_status": "SASS_OK", "sass_matches_expected": true, "sass_family": "OMMA.SF"}
}
